[
  {
    "id": "csltr_000_greeting",
    "dataset": "ISL-CSLTR",
    "split": "train",
    "language": "hi",
    "source_text": "नमस्ते आप कैसे हो?",
    "normalized_english": "namaste how are you you how",
    "gloss_sequence": ["HELLO", "YOU", "HOW"],
    "grammar_annotations": {
      "word_order": "GREETING_SUBJECT_QUESTION",
      "greeting": "HELLO",
      "subject": "YOU",
      "question_type": "HOW",
      "non_manual_markers": ["RESPECTFUL_HEAD_NOD", "EYEBROWS_RAISED", "SLIGHT_HEAD_TILT"]
    },
    "domain": "greetings",
    "verified_signs": ["HELLO", "YOU", "HOW"],
    "license": "CC-BY-NC 4.0 Research"
  },
  {
    "id": "csltr_000_greeting_alt",
    "dataset": "ISL-CSLTR",
    "split": "train",
    "language": "hi",
    "source_text": "नमस्ते, आप कैसे हैं?",
    "normalized_english": "namaste how are you",
    "gloss_sequence": ["HELLO", "YOU", "HOW"],
    "grammar_annotations": {
      "word_order": "GREETING_SUBJECT_QUESTION",
      "greeting": "HELLO",
      "subject": "YOU",
      "question_type": "HOW",
      "non_manual_markers": ["RESPECTFUL_HEAD_NOD", "EYEBROWS_RAISED", "SLIGHT_HEAD_TILT"]
    },
    "domain": "greetings",
    "verified_signs": ["HELLO", "YOU", "HOW"],
    "license": "CC-BY-NC 4.0 Research"
  },
  {
    "id": "csltr_001",
    "dataset": "ISL-CSLTR",
    "split": "train",
    "language": "en",
    "source_text": "Good morning, how are you?",
    "normalized_english": "good morning how are you",
    "gloss_sequence": ["GOOD", "MORNING", "YOU", "HOW"],
    "grammar_annotations": {
      "word_order": "TIME_TOPIC_QUESTION",
      "time_marker": "MORNING",
      "subject": "YOU",
      "question_type": "HOW",
      "non_manual_markers": ["EYEBROWS_RAISED", "SLIGHT_HEAD_TILT"]
    },
    "domain": "greetings",
    "verified_signs": ["GOOD", "MORNING", "YOU", "HOW"],
    "license": "CC-BY-NC 4.0 Research"
  },
  {
    "id": "csltr_002",
    "dataset": "ISL-CSLTR",
    "split": "train",
    "language": "hi",
    "source_text": "नमस्ते, आपका नाम क्या है?",
    "normalized_english": "namaste what is your name",
    "gloss_sequence": ["HELLO", "YOU", "NAME", "WHAT"],
    "grammar_annotations": {
      "word_order": "TOPIC_SUBJECT_OBJECT_QUESTION",
      "subject": "YOU",
      "object": "NAME",
      "question_type": "WHAT",
      "non_manual_markers": ["EYEBROWS_FURROWED"]
    },
    "domain": "greetings",
    "verified_signs": ["HELLO", "YOU", "NAME", "WHAT"],
    "license": "CC-BY-NC 4.0 Research"
  },
  {
    "id": "csltr_003",
    "dataset": "ISL-CSLTR",
    "split": "train",
    "language": "en",
    "source_text": "Where is the hospital?",
    "normalized_english": "where is the hospital",
    "gloss_sequence": ["HOSPITAL", "WHERE"],
    "grammar_annotations": {
      "word_order": "TOPIC_QUESTION",
      "topic": "HOSPITAL",
      "question_type": "WHERE",
      "non_manual_markers": ["EYEBROWS_FURROWED", "HEAD_TILT"]
    },
    "domain": "emergency",
    "verified_signs": ["HOSPITAL", "WHERE"],
    "license": "CC-BY-NC 4.0 Research"
  },
  {
    "id": "csltr_004",
    "dataset": "ISL-CSLTR",
    "split": "train",
    "language": "hi",
    "source_text": "मुझे डॉक्टर की मदद चाहिए",
    "normalized_english": "i need help from a doctor",
    "gloss_sequence": ["ME", "DOCTOR", "HELP", "WANT"],
    "grammar_annotations": {
      "word_order": "SOV",
      "subject": "ME",
      "object": "DOCTOR",
      "verb": "HELP"
    },
    "domain": "medical",
    "verified_signs": ["ME", "DOCTOR", "HELP"],
    "license": "CC-BY-NC 4.0 Research"
  },
  {
    "id": "csltr_005",
    "dataset": "ISL-CSLTR",
    "split": "train",
    "language": "en",
    "source_text": "Please give me water",
    "normalized_english": "please give me water",
    "gloss_sequence": ["PLEASE", "ME", "WATER", "GIVE"],
    "grammar_annotations": {
      "word_order": "POLITE_SOV",
      "subject": "ME",
      "object": "WATER",
      "verb": "GIVE"
    },
    "domain": "daily_life",
    "verified_signs": ["PLEASE", "ME", "WATER"],
    "license": "CC-BY-NC 4.0 Research"
  },
  {
    "id": "csltr_006",
    "dataset": "ISL-CSLTR",
    "split": "train",
    "language": "hi",
    "source_text": "आज मैं स्कूल नहीं जाऊंगा",
    "normalized_english": "today i will not go to school",
    "gloss_sequence": ["TODAY", "ME", "SCHOOL", "GO", "NO"],
    "grammar_annotations": {
      "word_order": "TIME_SOV_NEG",
      "time_marker": "TODAY",
      "subject": "ME",
      "object": "SCHOOL",
      "verb": "GO",
      "negation": "NO",
      "non_manual_markers": ["HEAD_SHAKE"]
    },
    "domain": "education",
    "verified_signs": ["TODAY", "ME", "NO"],
    "license": "CC-BY-NC 4.0 Research"
  },
  {
    "id": "csltr_007",
    "dataset": "ISL-CSLTR",
    "split": "train",
    "language": "en",
    "source_text": "Thank you very much for your help",
    "normalized_english": "thank you very much for help",
    "gloss_sequence": ["THANK-YOU", "HELP", "GOOD"],
    "grammar_annotations": {
      "word_order": "EXPRESSION_TOPIC_COMMENT",
      "topic": "HELP",
      "comment": "GOOD"
    },
    "domain": "greetings",
    "verified_signs": ["THANK-YOU", "HELP", "GOOD"],
    "license": "CC-BY-NC 4.0 Research"
  },
  {
    "id": "csltr_008",
    "dataset": "ISL-CSLTR",
    "split": "train",
    "language": "ta",
    "source_text": "உங்களுக்கு உதவி வேண்டுமா?",
    "normalized_english": "do you need help",
    "gloss_sequence": ["YOU", "HELP", "WANT", "WHAT"],
    "grammar_annotations": {
      "word_order": "SOV_QUESTION",
      "subject": "YOU",
      "object": "HELP",
      "verb": "WANT",
      "question_type": "YES_NO",
      "non_manual_markers": ["EYEBROWS_RAISED"]
    },
    "domain": "emergency",
    "verified_signs": ["YOU", "HELP", "WHAT"],
    "license": "CC-BY-NC 4.0 Research"
  },
  {
    "id": "csltr_009",
    "dataset": "ISL-CSLTR",
    "split": "val",
    "language": "hi",
    "source_text": "क्या आप ठीक हैं?",
    "normalized_english": "are you alright",
    "gloss_sequence": ["YOU", "GOOD", "YES"],
    "grammar_annotations": {
      "word_order": "TOPIC_COMMENT_CONFIRM",
      "subject": "YOU",
      "comment": "GOOD",
      "non_manual_markers": ["EYEBROWS_RAISED"]
    },
    "domain": "medical",
    "verified_signs": ["YOU", "GOOD", "YES"],
    "license": "CC-BY-NC 4.0 Research"
  },
  {
    "id": "csltr_010",
    "dataset": "ISL-CSLTR",
    "split": "train",
    "language": "en",
    "source_text": "Welcome to India",
    "normalized_english": "welcome to india",
    "gloss_sequence": ["INDIA", "WELCOME"],
    "grammar_annotations": {
      "word_order": "TOPIC_GREETING",
      "topic": "INDIA",
      "comment": "WELCOME"
    },
    "domain": "greetings",
    "verified_signs": ["INDIA", "WELCOME"],
    "license": "CC-BY-NC 4.0 Research"
  }
]
